p100-resnet50.log
{"i": ["cuda", "topi_nn_conv2d", [["TENSOR", [32, 256, 14, 14], "float32"], ["TENSOR", [256, 256, 3, 3], "float32"], [1, 1], [1, 1], [1, 1], "NCHW", "float32"], {}, ["conv2d", [32, 256, 14, 14, "float32"], [256, 256, 3, 3, "float32"], [1, 1], [1, 1], [1, 1], "NCHW", "float32"], {"i": 3632251, "t": "winograd", "e": [["tile_b", "sp", [16, 1, 1, 1]], ["tile_y", "sp", [2, 1, 32, 4]], ["tile_x", "sp", [49, 2, 8, 2]], ["tile_rc", "sp", [32, 8]], ["auto_unroll_max_step", "ot", 128], ["unroll_explicit", "ot", 1]], "c": null}], "v": 0.1, "r": [[0.00065524965], 0, 1.2665441036224365, 1546932699.5727808]}
{"i": ["cuda", "topi_nn_conv2d", [["TENSOR", [32, 1024, 14, 14], "float32"], ["TENSOR", [2048, 1024, 1, 1], "float32"], [2, 2], [0, 0], [1, 1], "NCHW", "float32"], {}, ["conv2d", [32, 1024, 14, 14, "float32"], [2048, 1024, 1, 1, "float32"], [2, 2], [0, 0], [1, 1], "NCHW", "float32"], {"i": 74016, "t": "direct", "e": [["tile_f", "sp", [16, 2, 32, 2]], ["tile_y", "sp", [1, 1, 1, 7]], ["tile_x", "sp", [1, 1, 7, 1]], ["tile_rc", "sp", [512, 2]], ["tile_ry", "sp", [1, 1]], ["tile_rx", "sp", [1, 1]], ["auto_unroll_max_step", "ot", 512], ["unroll_explicit", "ot", 0]], "c": null}], "v": 0.1, "r": [[0.0015192734], 0, 1.1213290691375732, 1546935686.9299943]}
{"i": ["cuda", "topi_nn_conv2d", [["TENSOR", [32, 512, 28, 28], "float32"], ["TENSOR", [256, 512, 1, 1], "float32"], [2, 2], [0, 0], [1, 1], "NCHW", "float32"], {}, ["conv2d", [32, 512, 28, 28, "float32"], [256, 512, 1, 1, "float32"], [2, 2], [0, 0], [1, 1], "NCHW", "float32"], {"i": 1340496, "t": "direct", "e": [["tile_f", "sp", [4, 2, 32, 1]], ["tile_y", "sp", [2, 1, 1, 7]], ["tile_x", "sp", [1, 1, 7, 2]], ["tile_rc", "sp", [256, 2]], ["tile_ry", "sp", [1, 1]], ["tile_rx", "sp", [1, 1]], ["auto_unroll_max_step", "ot", 0], ["unroll_explicit", "ot", 1]], "c": null}], "v": 0.1, "r": [[0.00045305425], 0, 0.925684928894043, 1546937382.939062]}
{"i": ["cuda", "topi_nn_conv2d_transpose_nchw", [["TENSOR", [32, 512, 28, 28], "float32"], ["TENSOR", [512, 512, 1, 1], "float32"], [1, 1], [0, 0], "float32"], {}, ["conv2d_transpose_nchw", [32, 512, 28, 28, "float32"], [512, 512, 1, 1, "float32"], [1, 1], [0, 0], "float32"], {"i": 101527290, "t": "direct", "e": [["tile_f", "sp", [8, 2, 4, 8]], ["tile_y", "sp", [7, 2, 2, 1]], ["tile_x", "sp", [1, 1, 28, 1]], ["tile_rc", "sp", [32, 8, 2]], ["auto_unroll_max_step", "ot", 1500], ["unroll_explicit", "ot", 1]], "c": null}], "v": 0.1, "r": [[0.0017932788500000002], 0, 1.5948288440704346, 1546941505.9982557]}
{"i": ["cuda", "topi_nn_conv2d", [["TENSOR", [32, 1024, 14, 14], "float32"], ["TENSOR", [512, 1024, 1, 1], "float32"], [2, 2], [0, 0], [1, 1], "NCHW", "float32"], {}, ["conv2d", [32, 1024, 14, 14, "float32"], [512, 1024, 1, 1, "float32"], [2, 2], [0, 0], [1, 1], "NCHW", "float32"], {"i": 47121, "t": "direct", "e": [["tile_f", "sp", [8, 2, 32, 1]], ["tile_y", "sp", [1, 1, 7, 1]], ["tile_x", "sp", [1, 7, 1, 1]], ["tile_rc", "sp", [256, 4]], ["tile_ry", "sp", [1, 1]], ["tile_rx", "sp", [1, 1]], ["auto_unroll_max_step", "ot", 512], ["unroll_explicit", "ot", 0]], "c": null}], "v": 0.1, "r": [[0.00049389225], 0, 0.970226526260376, 1546943116.5487041]}
{"i": ["cuda", "topi_nn_conv2d_transpose_nchw", [["TENSOR", [32, 128, 28, 28], "float32"], ["TENSOR", [128, 128, 3, 3], "float32"], [1, 1], [1, 1], "float32"], {}, ["conv2d_transpose_nchw", [32, 128, 28, 28, "float32"], [128, 128, 3, 3, "float32"], [1, 1], [1, 1], "float32"], {"i": 34877099, "t": "direct", "e": [["tile_f", "sp", [2, 2, 16, 2]], ["tile_y", "sp", [7, 4, 1, 1]], ["tile_x", "sp", [1, 1, 14, 2]], ["tile_rc", "sp", [64, 2, 1]], ["auto_unroll_max_step", "ot", 1500], ["unroll_explicit", "ot", 1]], "c": null}], "v": 0.1, "r": [[0.0009980009999999999], 0, 1.530092477798462, 1546944485.5244284]}
{"i": ["cuda", "topi_nn_conv2d", [["TENSOR", [32, 256, 14, 14], "float32"], ["TENSOR", [1024, 256, 1, 1], "float32"], [1, 1], [0, 0], [1, 1], "NCHW", "float32"], {}, ["conv2d", [32, 256, 14, 14, "float32"], [1024, 256, 1, 1, "float32"], [1, 1], [0, 0], [1, 1], "NCHW", "float32"], {"i": 843546, "t": "direct", "e": [["tile_f", "sp", [32, 4, 2, 4]], ["tile_y", "sp", [1, 7, 2, 1]], ["tile_x", "sp", [1, 1, 14, 1]], ["tile_rc", "sp", [64, 4]], ["tile_ry", "sp", [1, 1]], ["tile_rx", "sp", [1, 1]], ["auto_unroll_max_step", "ot", 512], ["unroll_explicit", "ot", 0]], "c": null}], "v": 0.1, "r": [[0.00054384545], 0, 1.1748924255371094, 1546946637.7511878]}
{"i": ["cuda", "topi_nn_conv2d", [["TENSOR", [32, 256, 56, 56], "float32"], ["TENSOR", [64, 256, 1, 1], "float32"], [1, 1], [0, 0], [1, 1], "NCHW", "float32"], {}, ["conv2d", [32, 256, 56, 56, "float32"], [64, 256, 1, 1, "float32"], [1, 1], [0, 0], [1, 1], "NCHW", "float32"], {"i": 6641901, "t": "direct", "e": [["tile_f", "sp", [1, 8, 8, 1]], ["tile_y", "sp", [28, 1, 1, 2]], ["tile_x", "sp", [1, 2, 28, 1]], ["tile_rc", "sp", [32, 8]], ["tile_ry", "sp", [1, 1]], ["tile_rx", "sp", [1, 1]], ["auto_unroll_max_step", "ot", 512], ["unroll_explicit", "ot", 0]], "c": null}], "v": 0.1, "r": [[0.00055282325], 0, 1.0955932140350342, 1546948360.6592295]}
{"i": ["cuda", "topi_nn_conv2d", [["TENSOR", [32, 512, 7, 7], "float32"], ["TENSOR", [512, 512, 3, 3], "float32"], [1, 1], [1, 1], [1, 1], "NCHW", "float32"], {}, ["conv2d", [32, 512, 7, 7, "float32"], [512, 512, 3, 3, "float32"], [1, 1], [1, 1], [1, 1], "NCHW", "float32"], {"i": 2640347, "t": "winograd", "e": [["tile_b", "sp", [16, 1, 1, 1]], ["tile_y", "sp", [4, 2, 16, 4]], ["tile_x", "sp", [16, 1, 8, 4]], ["tile_rc", "sp", [32, 16]], ["auto_unroll_max_step", "ot", 1500], ["unroll_explicit", "ot", 1]], "c": null}], "v": 0.1, "r": [[0.00069556115], 0, 1.8203561305999756, 1546950073.4431732]}
{"i": ["cuda", "topi_nn_conv2d_transpose_nchw", [["TENSOR", [32, 512, 7, 7], "float32"], ["TENSOR", [512, 512, 3, 3], "float32"], [1, 1], [1, 1], "float32"], {}, ["conv2d_transpose_nchw", [32, 512, 7, 7, "float32"], [512, 512, 3, 3, "float32"], [1, 1], [1, 1], "float32"], {"i": 194745, "t": "direct", "e": [["tile_f", "sp", [8, 1, 64, 1]], ["tile_y", "sp", [1, 7, 1, 1]], ["tile_x", "sp", [1, 7, 1, 1]], ["tile_rc", "sp", [512, 1, 1]], ["auto_unroll_max_step", "ot", 512], ["unroll_explicit", "ot", 0]], "c": null}], "v": 0.1, "r": [[0.00110860075], 0, 1.130742073059082, 1546953517.373358]}
{"i": ["cuda", "topi_nn_conv2d", [["TENSOR", [32, 64, 56, 56], "float32"], ["TENSOR", [256, 64, 1, 1], "float32"], [1, 1], [0, 0], [1, 1], "NCHW", "float32"], {}, ["conv2d", [32, 64, 56, 56, "float32"], [256, 64, 1, 1, "float32"], [1, 1], [0, 0], [1, 1], "NCHW", "float32"], {"i": 25718618, "t": "direct", "e": [["tile_f", "sp", [4, 4, 8, 2]], ["tile_y", "sp", [28, 1, 1, 2]], ["tile_x", "sp", [1, 2, 28, 1]], ["tile_rc", "sp", [8, 8]], ["tile_ry", "sp", [1, 1]], ["tile_rx", "sp", [1, 1]], ["auto_unroll_max_step", "ot", 0], ["unroll_explicit", "ot", 1]], "c": null}], "v": 0.1, "r": [[0.0006156363], 0, 1.0764541625976562, 1546955561.6074486]}
{"i": ["cuda", "topi_nn_conv2d_transpose_nchw", [["TENSOR", [32, 64, 56, 56], "float32"], ["TENSOR", [64, 64, 3, 3], "float32"], [1, 1], [1, 1], "float32"], {}, ["conv2d_transpose_nchw", [32, 64, 56, 56, "float32"], [64, 64, 3, 3, "float32"], [1, 1], [1, 1], "float32"], {"i": 78734338, "t": "direct", "e": [["tile_f", "sp", [2, 1, 16, 2]], ["tile_y", "sp", [4, 7, 1, 2]], ["tile_x", "sp", [14, 1, 2, 2]], ["tile_rc", "sp", [1, 64, 1]], ["auto_unroll_max_step", "ot", 1500], ["unroll_explicit", "ot", 1]], "c": null}], "v": 0.1, "r": [[0.00096620015], 0, 1.4340548515319824, 1546958187.3358104]}
{"i": ["cuda", "topi_nn_conv2d", [["TENSOR", [32, 2048, 7, 7], "float32"], ["TENSOR", [512, 2048, 1, 1], "float32"], [1, 1], [0, 0], [1, 1], "NCHW", "float32"], {}, ["conv2d", [32, 2048, 7, 7, "float32"], [512, 2048, 1, 1, "float32"], [1, 1], [0, 0], [1, 1], "NCHW", "float32"], {"i": 225105, "t": "direct", "e": [["tile_f", "sp", [8, 1, 64, 1]], ["tile_y", "sp", [1, 1, 1, 7]], ["tile_x", "sp", [1, 1, 1, 7]], ["tile_rc", "sp", [256, 8]], ["tile_ry", "sp", [1, 1]], ["tile_rx", "sp", [1, 1]], ["auto_unroll_max_step", "ot", 1500], ["unroll_explicit", "ot", 1]], "c": null}], "v": 0.1, "r": [[0.0006695114], 0, 1.4941909313201904, 1546960361.414875]}
{"i": ["cuda", "topi_nn_conv2d_transpose_nchw", [["TENSOR", [32, 2048, 7, 7], "float32"], ["TENSOR", [2048, 2048, 1, 1], "float32"], [1, 1], [0, 0], "float32"], {}, ["conv2d_transpose_nchw", [32, 2048, 7, 7, "float32"], [2048, 2048, 1, 1, "float32"], [1, 1], [0, 0], "float32"], {"i": 598176, "t": "direct", "e": [["tile_f", "sp", [16, 2, 32, 2]], ["tile_y", "sp", [1, 1, 1, 7]], ["tile_x", "sp", [1, 1, 7, 1]], ["tile_rc", "sp", [256, 2, 4]], ["auto_unroll_max_step", "ot", 512], ["unroll_explicit", "ot", 0]], "c": null}], "v": 0.1, "r": [[0.00234481875], 0, 1.0977187156677246, 1546961596.5533023]}
{"i": ["cuda", "topi_nn_conv2d", [["TENSOR", [32, 64, 56, 56], "float32"], ["TENSOR", [64, 64, 3, 3], "float32"], [1, 1], [1, 1], [1, 1], "NCHW", "float32"], {}, ["conv2d", [32, 64, 56, 56, "float32"], [64, 64, 3, 3, "float32"], [1, 1], [1, 1], [1, 1], "NCHW", "float32"], {"i": 3738919, "t": "winograd", "e": [["tile_b", "sp", [36, 1, 1, 1]], ["tile_y", "sp", [1, 1, 4, 16]], ["tile_x", "sp", [98, 4, 16, 1]], ["tile_rc", "sp", [16, 4]], ["auto_unroll_max_step", "ot", 1500], ["unroll_explicit", "ot", 1]], "c": null}], "v": 0.1, "r": [[0.0007065385], 0, 2.9390337467193604, 1546963480.7248304]}
{"i": ["cuda", "topi_nn_conv2d_transpose_nchw", [["TENSOR", [32, 256, 14, 14], "float32"], ["TENSOR", [256, 256, 3, 3], "float32"], [1, 1], [1, 1], "float32"], {}, ["conv2d_transpose_nchw", [32, 256, 14, 14, "float32"], [256, 256, 3, 3, "float32"], [1, 1], [1, 1], "float32"], {"i": 1905951, "t": "direct", "e": [["tile_f", "sp", [4, 2, 32, 1]], ["tile_y", "sp", [1, 1, 1, 14]], ["tile_x", "sp", [7, 2, 1, 1]], ["tile_rc", "sp", [256, 1, 1]], ["auto_unroll_max_step", "ot", 512], ["unroll_explicit", "ot", 0]], "c": null}], "v": 0.1, "r": [[0.0009519047], 0, 1.3389511108398438, 1546966453.174176]}
{"i": ["cuda", "topi_nn_conv2d", [["TENSOR", [32, 512, 28, 28], "float32"], ["TENSOR", [128, 512, 1, 1], "float32"], [1, 1], [0, 0], [1, 1], "NCHW", "float32"], {}, ["conv2d", [32, 512, 28, 28, "float32"], [128, 512, 1, 1, "float32"], [1, 1], [0, 0], [1, 1], "NCHW", "float32"], {"i": 8525664, "t": "direct", "e": [["tile_f", "sp", [2, 8, 8, 1]], ["tile_y", "sp", [7, 2, 2, 1]], ["tile_x", "sp", [1, 2, 14, 1]], ["tile_rc", "sp", [32, 16]], ["tile_ry", "sp", [1, 1]], ["tile_rx", "sp", [1, 1]], ["auto_unroll_max_step", "ot", 512], ["unroll_explicit", "ot", 1]], "c": null}], "v": 0.1, "r": [[0.00057610065], 0, 1.5961284637451172, 1546968208.9258149]}
{"i": ["cuda", "topi_nn_conv2d_transpose_nchw", [["TENSOR", [32, 256, 56, 56], "float32"], ["TENSOR", [256, 256, 1, 1], "float32"], [1, 1], [0, 0], "float32"], {}, ["conv2d_transpose_nchw", [32, 256, 56, 56, "float32"], [256, 256, 1, 1, "float32"], [1, 1], [0, 0], "float32"], {"i": 249750229, "t": "direct", "e": [["tile_f", "sp", [4, 1, 8, 8]], ["tile_y", "sp", [7, 2, 2, 2]], ["tile_x", "sp", [7, 1, 4, 2]], ["tile_rc", "sp", [32, 4, 2]], ["auto_unroll_max_step", "ot", 1500], ["unroll_explicit", "ot", 1]], "c": null}], "v": 0.1, "r": [[0.0016401015500000001], 0, 1.5926406383514404, 1546971881.9336777]}
{"i": ["cuda", "topi_nn_conv2d", [["TENSOR", [32, 128, 28, 28], "float32"], ["TENSOR", [128, 128, 3, 3], "float32"], [1, 1], [1, 1], [1, 1], "NCHW", "float32"], {}, ["conv2d", [32, 128, 28, 28, "float32"], [128, 128, 3, 3, "float32"], [1, 1], [1, 1], [1, 1], "NCHW", "float32"], {"i": 3925157, "t": "winograd", "e": [["tile_b", "sp", [16, 1, 1, 1]], ["tile_y", "sp", [2, 4, 4, 4]], ["tile_x", "sp", [98, 2, 16, 2]], ["tile_rc", "sp", [16, 8]], ["auto_unroll_max_step", "ot", 0], ["unroll_explicit", "ot", 1]], "c": null}], "v": 0.1, "r": [[0.00075753805], 0, 1.2241709232330322, 1546973861.6488693]}
{"i": ["cuda", "topi_nn_conv2d", [["TENSOR", [32, 256, 56, 56], "float32"], ["TENSOR", [128, 256, 1, 1], "float32"], [2, 2], [0, 0], [1, 1], "NCHW", "float32"], {}, ["conv2d", [32, 256, 56, 56, "float32"], [128, 256, 1, 1, "float32"], [2, 2], [0, 0], [1, 1], "NCHW", "float32"], {"i": 2001797, "t": "direct", "e": [["tile_f", "sp", [2, 4, 4, 4]], ["tile_y", "sp", [14, 2, 1, 1]], ["tile_x", "sp", [1, 1, 28, 1]], ["tile_rc", "sp", [128, 2]], ["tile_ry", "sp", [1, 1]], ["tile_rx", "sp", [1, 1]], ["auto_unroll_max_step", "ot", 512], ["unroll_explicit", "ot", 0]], "c": null}], "v": 0.1, "r": [[0.00039663169999999996], 0, 1.0804498195648193, 1546976134.8259327]}
{"i": ["cuda", "topi_nn_conv2d_transpose_nchw", [["TENSOR", [32, 1024, 14, 14], "float32"], ["TENSOR", [1024, 1024, 1, 1], "float32"], [1, 1], [0, 0], "float32"], {}, ["conv2d_transpose_nchw", [32, 1024, 14, 14, "float32"], [1024, 1024, 1, 1, "float32"], [1, 1], [0, 0], "float32"], {"i": 20963996, "t": "direct", "e": [["tile_f", "sp", [4, 1, 32, 8]], ["tile_y", "sp", [7, 1, 2, 1]], ["tile_x", "sp", [1, 7, 2, 1]], ["tile_rc", "sp", [128, 2, 4]], ["auto_unroll_max_step", "ot", 512], ["unroll_explicit", "ot", 1]], "c": null}], "v": 0.1, "r": [[0.0018921479500000002], 0, 1.5812122821807861, 1546978987.9181952]}
{"i": ["cuda", "topi_nn_conv2d", [["TENSOR", [32, 512, 28, 28], "float32"], ["TENSOR", [1024, 512, 1, 1], "float32"], [2, 2], [0, 0], [1, 1], "NCHW", "float32"], {}, ["conv2d", [32, 512, 28, 28, "float32"], [1024, 512, 1, 1, "float32"], [2, 2], [0, 0], [1, 1], "NCHW", "float32"], {"i": 1647748, "t": "direct", "e": [["tile_f", "sp", [8, 4, 16, 2]], ["tile_y", "sp", [7, 2, 1, 1]], ["tile_x", "sp", [1, 1, 14, 1]], ["tile_rc", "sp", [128, 4]], ["tile_ry", "sp", [1, 1]], ["tile_rx", "sp", [1, 1]], ["auto_unroll_max_step", "ot", 1500], ["unroll_explicit", "ot", 0]], "c": null}], "v": 0.1, "r": [[0.0014986381], 0, 1.0557029247283936, 1546980469.2232704]}
{"i": ["cuda", "topi_nn_conv2d", [["TENSOR", [32, 64, 56, 56], "float32"], ["TENSOR", [64, 64, 1, 1], "float32"], [1, 1], [0, 0], [1, 1], "NCHW", "float32"], {}, ["conv2d", [32, 64, 56, 56, "float32"], [64, 64, 1, 1, "float32"], [1, 1], [0, 0], [1, 1], "NCHW", "float32"], {"i": 5564264, "t": "direct", "e": [["tile_f", "sp", [2, 4, 8, 1]], ["tile_y", "sp", [28, 2, 1, 1]], ["tile_x", "sp", [1, 2, 28, 1]], ["tile_rc", "sp", [8, 8]], ["tile_ry", "sp", [1, 1]], ["tile_rx", "sp", [1, 1]], ["auto_unroll_max_step", "ot", 512], ["unroll_explicit", "ot", 0]], "c": null}], "v": 0.1, "r": [[0.00017185785], 0, 1.0826969146728516, 1546981711.0600505]}
{"i": ["cuda", "topi_nn_conv2d", [["TENSOR", [32, 512, 7, 7], "float32"], ["TENSOR", [2048, 512, 1, 1], "float32"], [1, 1], [0, 0], [1, 1], "NCHW", "float32"], {}, ["conv2d", [32, 512, 7, 7, "float32"], [2048, 512, 1, 1, "float32"], [1, 1], [0, 0], [1, 1], "NCHW", "float32"], {"i": 20783, "t": "direct", "e": [["tile_f", "sp", [64, 4, 8, 1]], ["tile_y", "sp", [1, 7, 1, 1]], ["tile_x", "sp", [1, 1, 7, 1]], ["tile_rc", "sp", [64, 8]], ["tile_ry", "sp", [1, 1]], ["tile_rx", "sp", [1, 1]], ["auto_unroll_max_step", "ot", 0], ["unroll_explicit", "ot", 0]], "c": null}], "v": 0.1, "r": [[0.0006903303000000001], 0, 1.0155935287475586, 1546983918.874975]}
{"i": ["cuda", "topi_nn_conv2d", [["TENSOR", [32, 1024, 14, 14], "float32"], ["TENSOR", [256, 1024, 1, 1], "float32"], [1, 1], [0, 0], [1, 1], "NCHW", "float32"], {}, ["conv2d", [32, 1024, 14, 14, "float32"], [256, 1024, 1, 1, "float32"], [1, 1], [0, 0], [1, 1], "NCHW", "float32"], {"i": 571121, "t": "direct", "e": [["tile_f", "sp", [8, 8, 2, 2]], ["tile_y", "sp", [1, 7, 2, 1]], ["tile_x", "sp", [1, 1, 14, 1]], ["tile_rc", "sp", [256, 4]], ["tile_ry", "sp", [1, 1]], ["tile_rx", "sp", [1, 1]], ["auto_unroll_max_step", "ot", 512], ["unroll_explicit", "ot", 0]], "c": null}], "v": 0.1, "r": [[0.0005479788], 0, 1.349367618560791, 1546986254.6283584]}
{"i": ["cuda", "topi_nn_conv2d", [["TENSOR", [32, 3, 224, 224], "float32"], ["TENSOR", [64, 3, 7, 7], "float32"], [2, 2], [3, 3], [1, 1], "NCHW", "float32"], {}, ["conv2d", [32, 3, 224, 224, "float32"], [64, 3, 7, 7, "float32"], [2, 2], [3, 3], [1, 1], "NCHW", "float32"], {"i": 30082104, "t": "direct", "e": [["tile_f", "sp", [1, 4, 16, 1]], ["tile_y", "sp", [112, 1, 1, 1]], ["tile_x", "sp", [1, 7, 16, 1]], ["tile_rc", "sp", [3, 1]], ["tile_ry", "sp", [1, 7]], ["tile_rx", "sp", [7, 1]], ["auto_unroll_max_step", "ot", 1500], ["unroll_explicit", "ot", 0]], "c": null}], "v": 0.1, "r": [[0.0011779118], 0, 1.5942027568817139, 1546987893.0757742]}
{"i": ["cuda", "topi_nn_conv2d", [["TENSOR", [32, 128, 28, 28], "float32"], ["TENSOR", [512, 128, 1, 1], "float32"], [1, 1], [0, 0], [1, 1], "NCHW", "float32"], {}, ["conv2d", [32, 128, 28, 28, "float32"], [512, 128, 1, 1, "float32"], [1, 1], [0, 0], [1, 1], "NCHW", "float32"], {"i": 14883074, "t": "direct", "e": [["tile_f", "sp", [16, 4, 4, 2]], ["tile_y", "sp", [7, 1, 4, 1]], ["tile_x", "sp", [1, 7, 4, 1]], ["tile_rc", "sp", [32, 4]], ["tile_ry", "sp", [1, 1]], ["tile_rx", "sp", [1, 1]], ["auto_unroll_max_step", "ot", 1500], ["unroll_explicit", "ot", 1]], "c": null}], "v": 0.1, "r": [[0.0005196682999999999], 0, 1.370051383972168, 1546990524.8850238]}
{"i": ["cuda", "topi_nn_conv2d", [["TENSOR", [32, 256, 56, 56], "float32"], ["TENSOR", [512, 256, 1, 1], "float32"], [2, 2], [0, 0], [1, 1], "NCHW", "float32"], {}, ["conv2d", [32, 256, 56, 56, "float32"], [512, 256, 1, 1, "float32"], [2, 2], [0, 0], [1, 1], "NCHW", "float32"], {"i": 4364886, "t": "direct", "e": [["tile_f", "sp", [8, 2, 16, 2]], ["tile_y", "sp", [28, 1, 1, 1]], ["tile_x", "sp", [1, 2, 14, 1]], ["tile_rc", "sp", [32, 8]], ["tile_ry", "sp", [1, 1]], ["tile_rx", "sp", [1, 1]], ["auto_unroll_max_step", "ot", 512], ["unroll_explicit", "ot", 0]], "c": null}], "v": 0.1, "r": [[0.0014398517], 0, 1.0102427005767822, 1546992139.4218621]}
